duration_seconds_int,comments,city,date_posted,longitude,state,duration_seconds,duration_hours,id,shape,datetime,latitude,country
300,there were rapid flashing lights alternating from the left side of the craft to the right side whille being staionery.,missouri city,2009-01-10,-95.5375,tx,300,one hour,17525,oval,2008-12-01 22:15:00.000000,29.6183333,us
300,Large house size flat white light (similar to Christmas lights on house) just above  horizon,belton,2011-01-05,-97.4641667,tx,300,5 minutes,17558,other,2010-12-01 03:00:00.000000,31.0558333,us
120,two orange lights / spheres moving together across sky&#44 then they danced and left into the stars. amazing,the woodlands,2011-01-05,-95.4891667,tx,120,2 minutes,17568,sphere,2010-12-01 22:00:00.000000,30.1577778,us
0.5,comet looking object seen on NW side of San Antonio TX at 10:19pm 1/21/10,san antonio,2010-02-14,-98.4933333,tx,0.5,1/2 second,17569,sphere,2010-01-21 22:19:00.000000,29.4238889,us
150,2 Hovering orange orbs seen late at night.,midland,2011-01-31,-102.0775,tx,150,2.5 minute,17580,formation,2011-01-21 10:50:00.000000,31.9972222,us
60,Bright Red Orange Sphere Gliding at Tree Level,corpus christi,2013-12-05,-97.3961111,tx,60,1 minute,17638,sphere,2013-12-01 20:00:00.000000,27.8002778,us
600,Lights appeared above Laredo,fredericksburg,2001-04-28,-98.8716667,tx,600,10 minutes,17679,light,1996-12-12 18:00:00.000000,30.2750000,us
20,I was sitting in a stand hunting when I caught the reflection of a light on my glasses.  I looked up and thought it was a planet which,atlanta (e of&#44 near the la border),2002-11-20,-94.1641667,tx,20,20 seconds,17680,fireball,1998-12-12 18:45:00.000000,33.1136111,us
600,Perfectly Straight Light Line in the Sky above the Cloud Level. Looked like a crack in Sky.,houston,2004-01-17,-95.3630556,tx,600,10 minutes,17703,other,2003-12-12 18:00:00.000000,29.7630556,us
2700,Triangular shape craft seen from the Houston&#44 Tx. area on 12/12/04 @ 2 a.m.,friendswood,2004-12-14,-95.2008333,tx,2700,45 min,17708,triangle,2004-12-12 02:00:00.000000,29.5291667,us
10,Two linear groups of maneuvering lights over Dallas&#44 Texas 12/12/04,dallas,2005-01-19,-96.8,tx,10,5-10 seconds,17715,formation,2004-12-12 20:25:00.000000,32.7833333,us
300,22 orange-yellow UFOs&#44 flying low&#44 fast and silently east to south over Texas A&amp;M University 4 randomly moving followed by 18 in a line,college station,2004-12-14,-96.3341667,tx,300,5 minutes,17718,triangle,2004-12-12 22:15:00.000000,30.6277778,us
240,triangle over austin tx,austin,2005-12-16,-97.7427778,tx,240,3-4 mims,17728,triangle,2005-12-12 22:30:00.000000,30.2669444,us
10,V shaped lights over Houston,houston,2002-12-23,-95.3630556,tx,10,10 seconds,17895,triangle,2002-12-13 21:15:00.000000,29.7630556,us
480,Coming through Anthony Gap heading towards Northeast El Paso at about 11:00PM going south I spotted a dim light fly down the mountain s,el paso,2003-02-25,-106.4863889,tx,480,8 minutes,17897,light,2002-12-13 23:00:00.000000,31.7586111,us
20,I witnessed a cluster of extremely bright white&#44 blue and red strobe type lights at a low altitude for about two hours.,emory,2005-01-11,-95.7652778,tx,20,two hours - plus,17913,cone,2004-12-13 20:00:00.000000,32.8744444,us
300,strange zooming light over Fort Worth.,fort worth,2010-02-14,-97.3205556,tx,300,5 minutes,17981,other,2009-12-13 22:45:00.000000,32.7252778,us
600,Oval shaped with strange tail of white and grey with yellow.,rye,2012-12-20,-94.7686111,tx,600,10 minutes,18009,oval,2012-12-13 16:00:00.000000,30.4525000,us
2,Two of us saw large round light - donut shaped&#44 I saw it as white/light blue&#44 my friend saw it as being green. It was in the north sky&#44,garland,2012-12-20,-96.6386111,tx,2,2 seconds,18031,circle,2012-12-13 00:00:00.000000,32.9125000,us
2,Driving in the country roads,wharton,1999-01-28,-96.1025,tx,2,1-2 sec,18076,light,1998-12-14 00:00:00.000000,29.3113889,us
120,Freeway Arc Light,el paso,2002-12-23,-106.4863889,tx,120,2 minutes,18097,unknown,2002-12-14 05:00:00.000000,31.7586111,us
90,I saw a dim indeterminately shaped object that flew silently about 1.5 degrees per second whose only hint of its appearance was in the,garland,2004-12-14,-96.6386111,tx,90,1 min 30 sec.,18109,unknown,2004-12-14 00:30:00.000000,32.9125000,us
120,A orange color light stationary&#44 then another blinking on almost like car headlights but in the sky and big. The second light was the f,walnut springs,2010-02-14,-97.7491667,tx,120,2 min,18167,light,2009-12-14 21:00:00.000000,32.0575000,us
3600,Watched star like object on the horizan go up in an arch and then approach me and fly close enough so I could see the pilot.,beaumont,1999-05-24,-94.1016667,tx,3600,1 hour,18231,cigar,1974-12-15 02:00:00.000000,30.0858333,us
8,looked like a really BIG .. long lasting.. blue/green shooting star.  appeared from top of my windshield and vanished in the distance.,katy,2000-02-16,-95.8241667,tx,8,aprox. 8 seconds,18299,fireball,1999-12-15 19:00:00.000000,29.7855556,us
0.5,Flare-like object blasts across sky at unthinkable speed over Austin Texas,austin,2001-02-18,-97.7427778,tx,0.5,.5 seconds,18313,,2000-12-15 21:00:00.000000,30.2669444,us
900,three bright lights motonless for minutes&#44 then sped away,jewett,2004-04-27,-96.1438889,tx,900,15 minutes,18343,light,2003-12-15 18:00:00.000000,31.3613889,us
3600,Bright lights continually making the sign of the cross,palestine,2004-08-24,-95.6305556,tx,3600,1 hour,18348,light,2003-12-15 22:00:00.000000,31.7619444,us
15,Very faint&#44 fast-moving  lights viewed through night-vision-goggles,northeastern,2007-11-28,-98.323221,tx,15,15 sec,18378,cone,2006-12-15 01:00:00.000000,29.546235,
600,Black triangular craft seen from below and side views with an array of lights,richland hills,2010-02-14,-97.2277778,tx,600,10 minutes,18423,triangle,2009-12-15 12:23:00.000000,32.8158333,us
7200,flashing lights in a certain spot in sky seeming to communicate with one another.,emory-yantis,2011-12-12,-95.574956,tx,7200,2 hours,18430,light,2010-12-15 03:00:00.000000,32.930399,
900,High altitude light beams out of clouds in vertical pattern.,abilene,2012-12-20,-99.7327778,tx,900,15 minutes,18462,light,2012-12-15 21:40:00.000000,32.4486111,us
600,Lights over downtown Austin.,austin,2013-12-23,-97.7427778,tx,600,10 minutes,18466,light,2013-12-15 16:10:00.000000,30.2669444,us
180,Object southbound&#44 displaying three white lights&#44 slowed&#44 hovered&#44 quickly accelerated and made a low&#44 banking turn to the east and the,lubbock,1999-01-28,-101.8547222,tx,180,3 minutes,18488,chevron,1998-12-16 19:40:00.000000,33.5777778,us
7,Fast point of light (no tail) decending rapidly towards the earth at a down angle of ~45 degrees of 45 degrees,conroe,1999-01-28,-95.4558333,tx,7,7 seconds,18489,light,1998-12-16 20:53:00.000000,30.3116667,us
60,We saw a light in the night sky which appeared to be a satellite&#44 but was moving much too fast.,athens,2000-12-20,-95.8552778,tx,60,1 minute,18504,light,2000-12-16 19:00:00.000000,32.2047222,us
20,oval shaped&#44 various random colors&#44 S like flight pattern&#44 vanished.,new braunfels,2003-12-19,-98.1241667,tx,20,20 seconds,18516,oval,2003-12-16 04:30:00.000000,29.7027778,us
300,Triangular shaped object spotted in Texas night sky,glen rose,2003-12-19,-97.755,tx,300,4-5 min,18517,triangle,2003-12-16 10:50:00.000000,32.2344444,us
600,Unknown Light over Austin&#44 TX,austin,2007-02-01,-97.7427778,tx,600,10 min,18575,light,2006-12-16 23:00:00.000000,30.2669444,us
1200,Bright light UFOs. Thought the UFO was going to crash into an airplane. Star-like UFOs.,gilmer,2011-01-05,-94.9422222,tx,1200,one hour,18587,light,2008-12-16 21:00:00.000000,32.7286111,us
600,Glowing Light Seen Over Leakey Texas,leakey,2010-02-14,-99.7611111,tx,600,10 minutes,18590,oval,2009-12-16 06:30:00.000000,29.7286111,us
3600,Near Coleman&#44 TX... Orange lights off and on&#44 with no sound,coleman (near),2011-01-05,-99.4261111,tx,3600,1 hr,18597,circle,2010-12-16 19:00:00.000000,31.8272222,us
40,triangular shape&#44 rounded on ends&#44 1 lg yellow/orange light on each corner of triangle,woodville (outside),1999-07-05,-94.4152778,tx,40,30-40 sec.,18654,triangle,1996-12-17 20:17:00.000000,30.7750000,us
240,There were 3 lights&#44 2 white and 1 red that strobed occasionally and no sound.,jonestown,2003-12-19,-97.9230556,tx,240,4 min,18696,light,2003-12-17 18:40:00.000000,30.4952778,us
180,A rectangle of lights that floated across the sky.,jonestown,2003-12-19,-97.9230556,tx,180,3 min,18698,rectangle,2003-12-17 19:35:00.000000,30.4952778,us
10800,12/17/07 Corpus Christi Tx Orange ball light comming at me 8 to 900mph when I shinned LED light at it.,corpus christi,2009-01-10,-97.3961111,tx,10800,2 to 3 hours,18717,sphere,2007-12-17 05:00:00.000000,27.8002778,us
15,12-17-12  Circular object to the west 30 degrees up pulsing bright then dim.  Duration&#44 15 seconds&#44 2 witnesses at 9:35 pm.Fritch tx.,fritch,2012-12-20,-101.6027778,tx,15,15 seconds,18766,circle,2012-12-17 02:00:00.000000,35.6397222,us
300,Saw bright orange light (size of Venus)  with diffuse and changing orange haze 1/2 size of moon around central light.,the woodlands,1999-01-28,-95.4891667,tx,300,5 minutes,18796,light,1996-12-18 22:00:00.000000,30.1577778,us
3600,I saw a UFO without a doubt a UFO&#33,texarkana,2005-01-11,-94.0475,tx,3600,1 hour,18832,circle,2004-12-18 05:30:00.000000,33.4250000,us
360,it was right above the tree line,bogata,2011-01-05,-95.2136111,tx,360,6 minutes,18878,disk,2010-12-18 00:00:00.000000,33.4705556,us
180,I saw a bright light in the northern sky moving east to west faster than a normal aircraft &amp; making fast and slow turns.,gunter,2012-12-20,-96.7472222,tx,180,3 minutes,18913,light,2012-12-18 17:00:00.000000,33.4477778,us
3000,I am located about 35 miles slightly northwest of downtown Houston&#44 TX and about 12 miles directly east of Magnolia&#44 TX.  I observed tw,magnolia,1999-02-16,-95.7505556,tx,3000,50 minutes,18940,light,1998-12-19 00:57:00.000000,30.2091667,us
300,I spoted a copper/amber colored object moving from the se to the west. Observed it through a telescope. Seen a cluster of 15 to 20 disk,houston,2000-01-07,-95.3630556,tx,300,5 minutes,18946,disk,1999-12-19 01:15:00.000000,29.7630556,us
30,Low and slow in the Houston night sky.,katy,2002-12-23,-95.8241667,tx,30,30 seconds,18965,chevron,2002-12-19 19:00:00.000000,29.7855556,us
300,orange lights large chevron void in skyview (stars planets),crockett,2003-02-25,-95.4563889,tx,300,5 minutes,18967,chevron,2002-12-19 22:00:00.000000,31.3180556,us
45,2 blue-lit conicle objects rotate around each other and then &quot;morph&quot; into 1 object and disappear.,austin,2004-01-17,-97.7427778,tx,45,45 seconds,18971,changing,2003-12-19 02:30:00.000000,30.2669444,us
2,Gliding silver object there one second&#44 gone the next,austin,2004-01-17,-97.7427778,tx,2,seconds,18976,unknown,2003-12-19 11:00:00.000000,30.2669444,us
3600,Well about the 19 of december 2007 I saw a &quot;bright light&quot;moving toward me &#44then to the right &#44left&#44 right and then solidifies  to a squ,el paso,2008-03-04,-106.4863889,tx,3600,01:00hours,18997,fireball,2007-12-19 17:00:00.000000,31.7586111,us
1800,While viewing M42 through telescope&#44 we witness 3 anamolous moving lights&#44 two with scope&#44 one with naked eye&#44 approx. 10-15 min. apart,austin,1999-01-28,-97.7427778,tx,1800,30 minutes,19067,light,1997-01-02 19:15:00.000000,30.2669444,us
420,Cone shape that changed to circle  seen over Tamaulipas Mexico from Harlingen Texas.,harlingen,2006-02-14,-97.6958333,tx,420,7 mins,19133,cone,2006-01-02 17:15:00.000000,26.1902778,us
5400,Several UFO&#39s sighted near the big dipper.,ballinger,2009-01-10,-99.9469444,tx,5400,1.5 + hours,19173,other,2009-01-02 05:30:00.000000,31.7380556,us
1800,Light on top left of moon&#44 followed by white lights and jets.,austin,2014-01-10,-97.7427778,tx,1800,30 minutes,19228,circle,2014-01-02 17:30:00.000000,30.2669444,us
60,Reddish orange bright lights traveling very quickly  then disappearing.  Completely silent.,austin,2014-01-10,-97.7427778,tx,60,1 minute,19237,light,2014-01-02 22:15:00.000000,30.2669444,us
900,Humming and 3 Red Floating Spheres in my son&#39s room,paris,2004-07-25,-95.5552778,tx,900,15 minutes,19301,,2003-12-20 22:00:00.000000,33.6608333,us
20,I saw a light coming towards the ground and shot due west and then disappear. I know others saw the same thing&#44 they were all pointing,portland,2008-03-04,-97.3236111,tx,20,20 seconds,19333,light,2007-12-20 18:50:00.000000,27.8769444,us
3,An arc of about 7 white lights at a very high altitude moving West at a very high rate of speed,paris,2009-01-10,-95.5552778,tx,3,about 3 seconds,19336,other,2008-12-20 01:00:00.000000,33.6608333,us
3600,A RECTANGLE BLACK OBJECT STATIONARY IN MID -AIR ABOUT AN HR. WITNESSES ON HAND.,san antonio,2009-01-10,-98.4933333,tx,3600,1-hr.,19340,rectangle,2008-12-20 17:00:00.000000,29.4238889,us
4,I observed a brillian&#44 white&#44 ball of light flying at tremendous speed from West to East.,cedar park,2009-01-10,-97.82,tx,4,3-4 seconds,19342,light,2008-12-20 19:40:00.000000,30.5050000,us
210,Four cigars flashing and spinning in mid air.,stagecoach,2012-01-12,-95.7133333,tx,210,3.5 min,19374,cigar,2011-12-20 22:45:00.000000,30.1452778,us
300,Viewed a 5-6 shaped ufo&#44 with pulsating lights hovering above my vehicle on highsway 36 near Cameron Texas.,cameron (near&#44 on highway),2012-12-21,-96.9766667,tx,300,2-5 minutes,19400,diamond,2012-12-20 23:30:00.000000,30.8530556,us
600,Octagon shaped bright grayish ship in sky&#44 near Cameron&#44 Texas on highway 36. Blinking. Fast. Scary,cameron,2012-12-21,-96.9766667,tx,600,~10 minutes,19401,other,2012-12-20 23:30:00.000000,30.8530556,us
60,Bright Light travelling over Houston Ship Channel&#44 with Red and Blue Lights flashing around the perimeter&#44 making Que-ball turns.,pasadena,2002-12-23,-95.2088889,tx,60,60 seconds,19435,light,2002-12-21 03:00:00.000000,29.6908333,us
5,Solid grey object moving fast over house,mesquite,2004-01-17,-96.5988889,tx,5,5 seconds,19450,unknown,2003-12-21 23:00:00.000000,32.7666667,us
7200,Expanding/retracting spherical object sighted in southwestern sky.  ((NUFORC Note:  We suspect a celestial body&#44 possibly Venus.  PD)),georgetown,2006-02-14,-97.6769444,tx,7200,2 hours,19463,circle,2005-12-21 21:00:00.000000,30.6325000,us
15,Flashes of Greenish/Blue light over Clear Lake,houston,2008-03-04,-95.3630556,tx,15,15 sec. in 1-2 sec. inter,19476,flash,2007-12-21 18:04:00.000000,29.7630556,us
5400,24 amber orbs hovering in Houston sky at 2AM 12.21.12,webster,2013-02-04,-95.1180556,tx,5400,1.5 hours,19507,changing,2012-12-21 02:00:00.000000,29.5375000,us
60,Took pictures of lighted object shooting something towards Earth during daylight.,magnolia,2013-02-04,-95.7505556,tx,60,1 minute,19513,other,2012-12-21 16:00:00.000000,30.2091667,us
10,Red/orange Light in sky above Burleson&#44 Texas 12-21-12.,burleson,2012-12-21,-97.3205556,tx,10,10 seconds,19516,light,2012-12-21 18:30:00.000000,32.5419444,us
2100,Multiple sightings of bright&#44 round orange objects within 30 minutes (at different locations).,sugar land,2013-02-04,-95.6347222,tx,2100,25-35 minutes,19518,fireball,2012-12-21 20:15:00.000000,29.6194444,us
20,Saucer Craft moving above highway.,san antonio,2013-12-23,-98.4933333,tx,20,20 seconds,19532,disk,2013-12-21 16:46:00.000000,29.4238889,us
300,UFO in Palacios&#44 TX&#44 plzz turn head to left or turn screen to left i recorded in landscape mode so u can see it better.,palacios,2013-12-23,-96.2172222,tx,300,5 minutes,19534,cylinder,2013-12-21 18:00:00.000000,28.7077778,us
600,((HOAX??))comet like white bright vapor,falcon,2008-07-05,-99.0952778,tx,600,10 minutes,19585,,2001-12-02 22:00:00.000000,26.6377778,us
300,UFO sighting ongoing in southeast texas  ((NUFORC Note:  Possible sighting of Sirius.  PD)),labelle,2004-01-31,-94.162299,tx,300,a half hour and still the,19617,triangle,2003-01-22 20:30:00.000000,29.902478,
180,On Dec 2nd two strange lights appeared around 9:30 - 9:45 pm coming from north- east going south-west,del rio,2004-12-14,-100.8963889,tx,180,3 min,19645,other,2004-12-02 21:00:00.000000,29.3625000,us
60,Bright green light at 2am.,crowley,2008-02-14,-97.3622222,tx,60,1 minute,19691,light,2008-01-22 02:30:00.000000,32.5788889,us
1800,Bright light in the night sky&#44 changes colors from red/green/yellow.  ((NUFORC Note:  Possible sighting of a star&#44 or Venus??  PD)),del rio,2011-01-05,-100.8963889,tx,1800,30 min.,19749,light,2010-12-02 21:30:00.000000,29.3625000,us
2400,This is a true story&#44 told just as it happened. One night (Approximately January 15th&#44 2010&#44 at 8:30 PM) while taking my 19 year ol,spring,2011-12-12,-95.4169444,tx,2400,40 min,19752,sphere,2010-01-22 23:00:00.000000,30.0797222,us
15,A single Triangle UFO flew quickly and silently over Cypress&#44 Texas&#44 at night.,cypress,2011-01-31,-95.6969444,tx,15,10 - 15 seconds,19764,triangle,2011-01-22 18:30:00.000000,29.9688889,us
60,V-formation of approximately 10 UFOs flying East to West at a high rate of speed and at an altitude of ~20&#44000 feet.  Hazy/ white color,cypress,2011-01-31,-95.6969444,tx,60,1 minute,19768,formation,2011-01-22 19:15:00.000000,29.9688889,us
240,I live in Arlington&#44 Tx. Is the norm to hear planes all the time.  DFW Airport is just north of us and only 20 min away.,arlington,2013-02-04,-97.1077778,tx,240,4 minutes,19797,triangle,2013-01-22 05:25:00.000000,32.7355556,us
60,I was driving on the highway when I noticed a rather large green &#39star&#39 in the sky. They started as small green balls and traveling qui,austin,2013-12-05,-97.7427778,tx,60,~1 minute,19813,fireball,2013-12-02 22:10:00.000000,30.2669444,us
5,Some sort of craft blew up probably when entering earth&#39s atmosphere.,new braunfels,2014-01-24,-98.1241667,tx,5,5 seconds,19827,teardrop,2014-01-22 19:37:00.000000,29.7027778,us
15,Small white ball over Houston.,houston,2014-01-30,-95.3630556,tx,15,15 seconds,19828,circle,2014-01-22 20:00:00.000000,29.7630556,us
180,45 of us were  on the Bus&#44 standing  to see the objects&#44 then flash&#44 and everyone was in their seats again,houston (west of),2004-06-18,-95.3630556,tx,180,3 minutes,19832,formation,1965-12-22 09:00:00.000000,29.7630556,us
120,strange black object over Houston TX on 12/22/10,houston,2011-01-05,-95.3630556,tx,120,aprox 2 min.,19917,changing,2010-12-22 10:37:00.000000,29.7630556,us
3600,Bright round light in sky that moved left to right then up with colorful lights.  ((NUFORC Note:  Possile sighting of Sirius?  PD)),dallas,2013-02-04,-96.8,tx,3600,1 hour,19933,light,2012-12-22 06:35:00.000000,32.7833333,us
2700,Strobing light in the sky over Ovilla&#44 Texas.,ovilla,2013-02-04,-96.8861111,tx,2700,45 minutes,19955,light,2012-12-22 23:30:00.000000,32.5263889,us
5,Boomerang object&#44 no sound,borger,2004-01-17,-101.3969444,tx,5,5 sec.,20013,other,2003-12-23 01:40:00.000000,35.6677778,us
10,The shiny hovering object sat there&#44 then it was suddenly gone.,abilene,2005-05-24,-99.7327778,tx,10,5-10 seconds,20029,oval,2004-12-23 16:00:00.000000,32.4486111,us
60,light &amp; object moving caught on camera,burkeville,2010-02-14,-93.6677778,tx,60,1 minute,20077,other,2009-12-23 15:49:00.000000,30.9997222,us
300,Rectangle shape the size of a football field&#44 width of about 30 feet&#44 entire ship outline in white neon like a vehicle from tron.,conroe,2012-01-12,-95.4558333,tx,300,5 minutes,20093,rectangle,2011-12-23 03:00:00.000000,30.3116667,us
600,THE OBJECT WAS A LARGE RED BALL OF LIGHT. IT WAS DESCENDING SLOWLY&#44 STRAIGHT DOWN.,pasadena,1998-06-18,-95.2088889,tx,600,about 10 minutes,20178,light,1995-12-24 00:00:00.000000,29.6908333,us
1200,Large Blue Light-1st Snow in 105 years.,harlingen,2010-08-24,-97.6958333,tx,1200,20min.,20230,other,2004-12-24 21:00:00.000000,26.1902778,us
240,Nighttime headlight looking objects on the road doing a 90 degree turn in front of my truck (twice).,brownsville,2008-10-31,-97.4972222,tx,240,3 to 4 minutes,20257,light,2007-12-24 00:15:00.000000,25.9013889,us
180,Star Like Craft,vidor,2013-02-04,-94.0152778,tx,180,3 minutes,20346,unknown,2012-12-24 06:20:00.000000,30.1313889,us
120,Approx. 10 amber colored objects flying in formation in a clear night sky.,spring,2014-01-10,-95.4169444,tx,120,2 minutes,20414,unknown,2013-12-24 22:00:00.000000,30.0797222,us
120,going outside to say goodbye to family when I looked into the sky and seen two lights one front of the other. Knowing to myself it look,pleasanton,2000-01-07,-98.4783333,tx,120,2 min,20452,cigar,1999-12-25 19:30:00.000000,28.9669444,us
15,A brilliant&#44 slow moving light&#44 sped up and disappeared&#33,pflugerville,2006-02-14,-97.6197222,tx,15,15 sec,20509,light,2005-12-25 20:11:00.000000,30.4391667,us
60,over austin flying,austin,2009-01-10,-97.7427778,tx,60,1 minute,20533,disk,2008-12-25 18:00:00.000000,30.2669444,us
5,A rather large yellow laser beam tracked from 20 feet behind my truck over my truck and down the hood.,seabrook,2010-02-14,-95.0252778,tx,5,5 seconds,20541,unknown,2009-12-25 00:30:00.000000,29.5638889,us
300,Huge&#44 silent aircraft seen under 500 feet Xmas night by trained observer for 4 to 5 minutes,cleburne,2010-02-14,-97.3863889,tx,300,4 to 5 minutes,20544,triangle,2009-12-25 19:46:00.000000,32.3475000,us
120,Round brilliant white object hovered and then slowly descended behind a hill in a remote area without making a noise.,forestburg,2005-04-16,-97.5563889,tx,120,one or two minutes,20666,sphere,1961-12-26 20:00:00.000000,33.5330556,us
180,Red object moving west to east&#44 person looking southward.  Appear as large as airplanes approaching Dallas/Ft.Worth airport  but travel,bonham,1998-03-07,-96.1780556,tx,180,2 to 3 minutes,20672,unknown,1997-12-26 21:35:00.000000,33.5772222,us
15,hello Sir/Mam&#44 On the night of 12/26/01 (the night after x-mas) @ 11:53 zulu .  Let me tell you a little about myself&#44 I grew up on mil,montgomery,2002-01-11,-95.6961111,tx,15,15 seconds,20705,triangle,2001-12-26 23:53:00.000000,30.3880556,us
900,Around Carswell AFB Ft. Worth&#44 TX&#44&#44red lights in the sky&#44&#44video taped them,fort worth,2003-02-25,-97.3205556,tx,900,15 min.,20709,light,2002-12-26 19:00:00.000000,32.7252778,us
900,Formation around cloud over lake that disappeared and emitted small bright light.,mico,2010-02-14,-98.9227778,tx,900,10-15min,20760,formation,2009-12-26 01:36:00.000000,29.5438889,us
30,Stationary white light hovering in southwest region of Houston&#44 Texas.,houston,2012-01-12,-95.3630556,tx,30,30 seconds,20782,light,2011-12-26 07:30:00.000000,29.7630556,us
600,A bank of 2 rows of lights hangs in the night sky just above town for a witnessed ten minutes,natalia,2003-02-25,-98.8622222,tx,600,10 minutes,20848,other,2002-12-27 18:20:00.000000,29.1894444,us
3,BRIGHT LIGHT FALLING FAST TOWARDS THE GROUND,plano,2006-02-14,-96.6986111,tx,3,2-3 sec.,20878,sphere,2005-12-27 22:40:00.000000,33.0197222,us
1085,Large group high flying lights,carrollton,2007-02-01,-96.89,tx,1085,18:05,20891,triangle,2006-12-27 22:30:00.000000,32.9536111,us
600,Dark Gray smokey shaped saucer above the highway,garland,2008-01-21,-96.6386111,tx,600,5-10 minutes,20893,disk,2007-12-27 07:30:00.000000,32.9125000,us
1,I saw a brilliant white ball of lightmoving roughly straight downward very fastprobably about 1 mile away.  It disapearedbehind trees.,hurst,1999-01-28,-97.1702778,tx,1,about 1 second,20974,light,1996-12-28 01:00:00.000000,32.8233333,us
900,Our dog was barking so I went to investigate. While watching the dogs outside I noticed a very bright light that seemed to be coming to,weatherford,1999-02-16,-97.7969444,tx,900,15 min.,20976,light,1998-12-28 05:45:00.000000,32.7591667,us
120,Saw very large object emerge from behind a hill in front of me on 408 Spur.  Long row of lights too bright for me to see shape of craft,dallas,2000-04-26,-96.8,tx,120,1-2 minutes,20981,unknown,1999-12-28 02:00:00.000000,32.7833333,us
6,Quick Flash,mansfield,2008-03-04,-97.1413889,tx,6,6 seconds,20992,flash,2000-12-28 12:00:00.000000,32.5630556,us
660,Bright&#44 burning&#44 descending small&#44 narrow oval shaped light over s/sw sky in Houston&#44 late afternoon/Dec 28&#44 00,houston,2001-01-03,-95.3630556,tx,660,11 minutes,20994,light,2000-12-28 17:09:00.000000,29.7630556,us
10,Bright Light High in sky moving north to south,houston,2002-01-11,-95.3630556,tx,10,10 seconds,21001,light,2001-12-28 18:30:00.000000,29.7630556,us
180,Triangular shape ship with red light on bottom moving a circular motion. Went very slowly.,richardson,2002-01-11,-96.7294444,tx,180,3 minutes,21002,triangle,2001-12-28 21:45:00.000000,32.9480556,us
300,Triangluar Object very low to the point of seeing detail hanging over the city.,austin,2007-02-01,-97.7427778,tx,300,5 minutes,21029,triangle,2005-12-28 18:00:00.000000,30.2669444,us
4,What might this be?,nacogdoches,2008-08-12,-94.6552778,tx,4,4 seconds,21050,unknown,2007-12-28 08:05:00.000000,31.6033333,us
900,Sightings of object in Bay City&#44 Texas,bay city,2008-03-04,-95.9691667,tx,900,10-15 minutes,21051,triangle,2007-12-28 19:00:00.000000,28.9825000,us
600,Bright lit  clouds on pitch dark night.,livingston,2013-02-04,-94.9327778,tx,600,10 minutes,21092,light,2012-12-28 19:00:00.000000,30.7108333,us
300,Orange lights and dark objects over League City&#44 Texas.,league city,2014-01-10,-95.0947222,tx,300,5 minutes,21121,light,2013-12-28 19:45:00.000000,29.5072222,us
1200,5 miles South of D&#8217;Hanis&#44 Texas on Farm to Market Road (FM) 2200 December 29&#44 1999 approx. 5 AM I stepped out of the back door and stoo,d&#39hanis,2000-02-16,-99.2794444,tx,1200,20 minutes,21145,unknown,1999-12-29 05:00:00.000000,29.3302778,us
300,Diamond shaped object that huvered above with a very brite glow.(not lights),sisterdale,2001-02-18,-98.7205556,tx,300,5 minutes,21152,diamond,2000-12-29 20:00:00.000000,29.9727778,us
