duration_seconds_int,comments,city,date_posted,longitude,state,duration_seconds,duration_hours,id,shape,datetime,latitude,country
7200,3 people in Abilene&#44 TX observe star-like object performing normally physically impossible maneuvers in night sky.,abilene,2003-11-08,-99.7327778,tx,7200,2 hours,56809,sphere,1995-07-15 00:00:00.000000,32.4486111,us
10800,Knowledge for a perpetual energy device&#44and how to create a gravity wave for anti-gravity perpulsion. FREE- ASK,amarillo,2003-06-18,-101.8308333,tx,10800,2-3hours,56842,other,1996-07-15 21:00:00.000000,35.2219444,us
5,flash of light while talking outside with my girlfriend,killeen/willow springs (area),2002-08-16,-97.763952,tx,5,5 seconds,56894,flash,1998-07-15 22:30:00.000000,31.106856,
1800,Bright Globe Circles House,somerville,2003-11-26,-96.5280556,tx,1800,30:00,56901,other,1999-07-15 02:00:00.000000,30.3458333,us
30,Extremely bright spherical object about 40 degrees above the east-northeast horizon&#44 about the size of a dime in the night sky.  Extrem,houston,1999-08-10,-95.3630556,tx,30,30 seconds,56914,sphere,1999-07-15 22:15:00.000000,29.7630556,us
5,Bright ball of light saw over top of house,kingsland,2003-05-09,-98.4402778,tx,5,5 seconds,56997,light,2002-07-15 04:30:00.000000,30.6580556,us
2700,High altitude steady lights passing from horizon to horizon not on sat paths,conroe,2004-07-25,-95.4558333,tx,2700,45 min,57053,light,2004-07-15 10:15:00.000000,30.3116667,us
900,Saw craft with bright clear light illuminating from &quot;portholes&quot; hovering over a field near our house,electra,2004-08-11,-98.9186111,tx,900,15 minutes,57068,disk,2004-07-15 23:45:00.000000,34.0291667,us
180,Fire and fast moving object in the sky.,orange,2005-09-02,-93.7363889,tx,180,2-3 minutes,57082,diamond,2005-07-15 17:00:00.000000,30.0927778,us
600,Sun City witness to UFO sightings?,el paso,2005-09-02,-106.4863889,tx,600,10 min,57083,disk,2005-07-15 19:00:00.000000,31.7586111,us
1800,Triangular UFO with blue smoke coming from it over San Antonio&#44 Texas,san antonio,2009-03-19,-98.4933333,tx,1800,30 minutes,57141,triangle,2007-07-15 16:30:00.000000,29.4238889,us
7200,It can&#39t be an Airplane or Star&#44 so what is it ?,san angelo,2010-07-19,-100.4366667,tx,7200,2 hrs.,57205,circle,2010-07-15 20:40:00.000000,31.4636111,us
180,Bright flashing lights that changed from red to blue to white. The UFO went from left to right and back and forth until disappearing th,dallas,2010-07-19,-96.8,tx,180,3 minutes,57211,flash,2010-07-15 21:30:00.000000,32.7833333,us
120,Bug zapping triagle craft.,terrell,2012-08-05,-96.275,tx,120,2 minutes,57259,triangle,2012-07-15 23:00:00.000000,32.7358333,us
11700,Spent a sunday in July 1967 at Crystal Beach with friends&#44 at dusk I spotted what appeared to be a speed boat in the Gulf heading towar,crystal beach,2000-01-22,-94.6394444,tx,11700,3.25 hours,57280,disk,1967-07-16 20:45:00.000000,29.4569444,us
9000,Multipul &quot;blinkers&quot; with red &#44blue and white strobing lights&#44 across the sky. only one circle shaped.,lufkin,2004-07-25,-94.7288889,tx,9000,2.5 hours,57345,circle,2004-07-16 03:00:00.000000,31.3380556,us
300,Alien encounter after UFO.,benbrook,2007-04-27,-97.4602778,tx,300,3-5 minutes,57357,light,2005-07-16 11:30:00.000000,32.6730556,us
15,Sml glowing object appeared out of nowhere&#44 remained motionless&#44 moved rapidly in straight line&#44 stopped again&#44 then vanished,benbrook,2005-09-02,-97.4602778,tx,15,15 sec,57367,light,2005-07-16 23:30:00.000000,32.6730556,us
7,Saw a Bird Shaped UFO flying towards Dallas&#44 no noise,wichita falls,2008-08-12,-98.4930556,tx,7,7 seconds,57398,other,2008-07-16 04:00:00.000000,33.9136111,us
30,Bright red object drifts slowly an then fades out,oakwood,2009-08-05,-95.8488889,tx,30,30 seconds,57413,light,2009-07-16 11:00:00.000000,31.5847222,us
120,My husband was sitting on the deck of our home&#44 which is surrounded by tall trees.  The sky was blue and clear.  Suddenly he heard a lo,bryan,2009-08-05,-96.3697222,tx,120,1 1/2 minutes,57415,unknown,2009-07-16 16:00:00.000000,30.6741667,us
360,My daughter and I were traveling on Hwy 105W between Moss Hill and Cleveland TX about 4:30 am.  There was not much traffic on the road,cleveland,2002-07-30,-95.0852778,tx,360,6 min,57541,flash,2002-07-17 04:45:00.000000,30.3411111,us
60,Unidentified shape near airport,addison,2002-07-30,-96.8288889,tx,60,1 minute,57544,other,2002-07-17 17:00:00.000000,32.9616667,us
600,three metallic spheres moving at great speeds and with difficult maneuvers&#44 watched for 5-10 minutes,san antonio,2004-06-18,-98.4933333,tx,600,5-10 minutes,57561,sphere,2003-07-17 20:00:00.000000,29.4238889,us
60,My friend and I were sitting at the banks of a narrow river&#44 across from a 127 foot cliff of a canyon. As we were looking at the stars&#44,leakey,2011-06-12,-99.7611111,tx,60,less than a minute,57607,light,2006-07-17 22:30:00.000000,29.7286111,us
3,Blue Green Flash burst seen raining down over July Texas sky at night.,caddo mills,2009-03-19,-96.2275,tx,3,3 seconds,57619,unknown,2008-07-17 00:45:00.000000,33.0655556,us
120,Highly advanced air craft silent&#44 very fast &#44 and im worried about my country.,weslaco,2012-12-20,-97.9905556,tx,120,2:00,57637,light,2009-07-17 21:00:00.000000,26.1591667,us
600,Stationery light in the sky,houston,2012-08-05,-95.3630556,tx,600,10 minutes,57691,light,2012-07-17 06:30:00.000000,29.7630556,us
20,N Dallas Tollway NOON July 17&#44 2013.,dallas,2013-07-22,-96.8,tx,20,20 seconds,57711,other,2013-07-17 12:00:00.000000,32.7833333,us
30,The first sighting this light that was as bright as a star was moving to fast to be anything I have ever seen and within about 30 secon,missourri city,2013-08-30,-95.537721,tx,30,first sighting 30 seconds,57728,fireball,2013-07-17 23:00:00.000000,29.618567,
600,Three oval shaped objects in open field.,dumas,2007-02-24,-101.9727778,tx,600,10 min,57733,oval,1975-07-18 19:00:00.000000,35.8655556,us
240,3 TIMES FROM 7/18 TO NOW AN ABDUCTION EVENT&#44 BUT NOT A SUCCESS FOR THEM.I AM A RESEARCHER AND HAD TAKEN A ABDUCTEE TO SAN ANTONIO FOR H,san antonio,1999-08-10,-98.4933333,tx,240,4 min,57764,unknown,1999-07-18 05:04:00.000000,29.4238889,us
1,Bright sphere of light&#44 30 degrees above western horizon traveling at extreme velocity from SW to W&#44 much too large to be a meteorite,houston,1999-08-10,-95.3630556,tx,1,1 sec,57769,circle,1999-07-18 22:30:00.000000,29.7630556,us
1200,On a clear night in Texas&#44while packing the truck 5 orange balls of light floatedand shot of in many differant ways.,robbins,2000-06-21,-96.1225,tx,1200,15or20min,57771,circle,1999-07-18 22:30:00.000000,31.2552778,us
120,the ufo was above a office,houston,2001-08-05,-95.3630556,tx,120,2 minutes,57780,oval,2001-07-18 16:30:00.000000,29.7630556,us
900,Bright star like object moved from W to E @ a slow pace&#44 for approx. 15 min. w/ fading brightness in &amp; out.,leakey,2001-08-20,-99.7611111,tx,900,approx 15 min,57788,light,2001-07-18 23:15:00.000000,29.7286111,us
60,Delta-shaped metallic object observed for about a minute&#44 and then disappeared.,el paso,2007-08-07,-106.4863889,tx,60,one minute,57838,other,2007-07-18 12:45:00.000000,31.7586111,us
900,Flying humanoid in houston?,houston,2008-08-12,-95.3630556,tx,900,15 minutes,57846,other,2008-07-18 19:00:00.000000,29.7630556,us
2100,Lights in the sky make themselves known.  ((NUFORC Note:  Possible sightings of satellites?  PD)),houston,2009-08-05,-95.3630556,tx,2100,35 minutes,57868,light,2009-07-18 04:50:00.000000,29.7630556,us
1800,B/t  border ot TX &amp; Mex; five indep lights in a triangle pat traveling in SE direction would stop &amp; hover.vanish over Gulf.,bluetown,2009-08-27,-97.8227778,tx,1800,30 minutes,57877,formation,2009-07-18 20:30:00.000000,26.0738889,us
300,Bright object suddenly gone,longview,2009-08-05,-94.7402778,tx,300,less than 5 minutes,57891,circle,2009-07-18 23:00:00.000000,32.5005556,us
1200,Black triangle UFO close to I-20 in East Texas,carthage,2011-12-12,-94.3372222,tx,1200,20 minutes,57921,triangle,2011-07-18 23:00:00.000000,32.1572222,us
300,Bright orange ball.,bonham,2011-08-07,-96.1780556,tx,300,5 min,57922,fireball,2011-07-18 23:30:00.000000,33.5772222,us
300,21 Orange Orbs over Baytown.,baytown,2013-07-22,-94.9772222,tx,300,5 minutes,57966,formation,2013-07-18 21:00:00.000000,29.7352778,us
300,I saw 2 objects that snined abluish white light on me .,houston,2008-02-14,-95.3630556,tx,300,5 minutes,57989,oval,1988-07-19 22:00:00.000000,29.7630556,us
7200,Spheres in a triangular formation over the skies of El Paso&#44 TX show their beauty as well as their capabilities and intelligence.,el paso,2003-10-07,-106.4863889,tx,7200,2 hrs,58009,sphere,2000-07-19 13:00:00.000000,31.7586111,us
2,Bright light moving fast and stopping over a Military base.,fort hood,2000-08-05,-97.741314,tx,2,2 sec.,58013,light,2000-07-19 22:35:00.000000,31.195001,
1800,((HOAX??))  gold box floating on water loud very loudare maybe floating above water it took off strate up.,coastline/offshore,2006-10-30,-99.901813,tx,1800,30min.,58067,other,2006-07-19 01:00:00.000000,31.968599,
10,Object seen in cloudy sky over Tomball,tomball,2007-08-07,-95.6158333,tx,10,10 seconds,58081,other,2007-07-19 05:10:00.000000,30.0969444,us
4,Bright Oval White Light Moving Super Fast Speeds East of Mckinney Texas,mckinney,2007-08-07,-96.615,tx,4,4 seconds,58086,oval,2007-07-19 23:19:00.000000,33.1975000,us
120,Orange light over Port Neches&#44 Texas,port neches,2011-08-07,-93.9583333,tx,120,2 minutes,58134,unknown,2011-07-19 22:30:00.000000,29.9911111,us
180,In 1974 I lived in El Paso&#44 I was unemployed&#44 I heard about a tire recaping company I desided pay them a visit&#44 and I ask the manager i,marfa,2006-07-16,-104.0186111,tx,180,3 menutes,58198,oval,1974-07-20 02:00:00.000000,30.3077778,us
900,we were driving around town.there is a golf course and one of the holes is close to the road.when all of a suuden as we were passing by,new gulf,2009-12-12,-95.885844,tx,900,10-15 minutes,58207,triangle,1976-07-20 21:00:00.000000,29.271532,
600,Was looking at all kinds of sites that came up on the Yahoo web site.  It talked about how people are looking at UFO sites.  It reminde,san marcos,2005-07-05,-97.9411111,tx,600,10 min,58229,rectangle,1986-07-20 03:30:00.000000,29.8830556,us
300,hovering flashing lights&#44 spotlight shining on my house,pittsburg,2002-12-23,-94.9655556,tx,300,5 minutes,58240,light,1990-07-20 23:00:00.000000,32.9952778,us
300,It shorted out the lights as it flew over &#44 without making a sound&#33,clear lake,2004-01-22,-96.495,tx,300,5 minutes or so,58257,teardrop,1996-07-20 22:00:00.000000,33.0780556,us
8,Bright amber light&#44 very high speed&#44 no sound or trail&#44 east to west over Padre Island&#44 summer 2000.,south padre island,2011-05-02,-97.1644444,tx,8,8 seconds,58285,oval,2000-07-20 21:00:00.000000,26.1033333,us
180,It was a cylinder that had 3 bright spotlights and moved too slowly and quietly to be a helicopter&#33,san marcos,2006-07-16,-97.9411111,tx,180,3 minutes,58310,cylinder,2001-07-20 23:00:00.000000,29.8830556,us
180,low-flying&#44 helicopter-sounding&#44 aircraft or circle shaped (from underneath)&#44 and had  few lights + bright spotlight,austin,2001-08-05,-97.7427778,tx,180,three minutes,58313,circle,2001-07-20 23:59:00.000000,30.2669444,us
6,IT COMPLETELY COVERED OUR WINDSHIELD AND IN IT THERE WERE APPROXIMATELY 30-50 BRIGHT  LIGHTS&#44 EVENLY SPACED&#44 SHINING BRIGHTLY.  WHEN IT,splendora,2003-07-16,-95.1608333,tx,6,6 seconds,58320,oval,2002-07-20 21:00:00.000000,30.2327778,us
3,Black teardrop shaped object seen passing across the moon leaving shadow on moons suface.,carrollton,2002-07-26,-96.89,tx,3,3 seconds,58329,teardrop,2002-07-20 23:35:00.000000,32.9536111,us
30,Green glowing floating sphere the size of a basketball witnessed by a man swimming in the middle of the night,katy,2013-05-15,-95.8241667,tx,30,30 seconds,58335,sphere,2003-07-20 02:30:00.000000,29.7855556,us
20,I saw a white cylindrical object&#8212;the same I saw and reported on 6/23/05&#8212;and got two photos of it.,avinger (lake o&#39 the pines),2005-09-02,-94.5561111,tx,20,20 seconds,58367,cylinder,2005-07-20 19:54:00.000000,32.8997222,us
1200,2:20 am July 20-08 Fort Davis&#44 Texas&#44 Davis Mountains Resort lights moving in l shape red blue green. n.west sky.,fort davis,2008-08-12,-103.8941667,tx,1200,20 min,58406,light,2008-07-20 02:20:00.000000,30.5880556,us
900,Recalled childhood experience,houston,2006-03-11,-95.3630556,tx,900,15 minutes,58527,other,1998-07-21 21:00:00.000000,29.7630556,us
60,Three UFO&#39s were spotted by six people in the middle of Corpus Christi&#44 Texas.,corpus christi,2010-07-28,-97.3961111,tx,60,1 minuet,58662,circle,2010-07-21 19:00:00.000000,27.8002778,us
15,Bright sphere hovering low with no sound darts off incredibly fast and disappears,wheatland (used 2 be whiskey flats),2011-08-07,-99.8969444,tx,15,10-15 seconds,58683,sphere,2011-07-21 23:30:00.000000,34.3111111,us
5,Low flying craft with large shadow,rhome,2012-08-05,-97.4716667,tx,5,5 seconds max,58689,oval,2012-07-21 10:30:00.000000,33.0533333,us
2100,Second time I have seen this Light in the sky same place moves very little red and green lights very high in the sky not a star not a p,plano,1999-08-10,-96.6986111,tx,2100,35min+,58757,unknown,1999-07-02 00:05:00.000000,33.0197222,us
3,Object was a fast moving fireball&#44 that moved towards the ground&#44 disappeared and scared my dogs(and me).,dallas,2008-07-05,-96.8,tx,3,2-3 seconds,58828,fireball,2008-07-02 03:00:00.000000,32.7833333,us
120,walked dog 3 a. m. very large flash behind me that left a light trail that changed colors&#44 it was not a shooting star,round rock,2008-08-12,-97.6786111,tx,120,1-2 minutes,58829,flash,2008-07-02 03:00:00.000000,30.5080556,us
3600,The object came after me after I tried to take a picture and I think the camera flash caused it all.,san antonio/cambleton,2008-07-05,-98.305377,tx,3600,1 hour,58830,other,2008-07-02 03:00:00.000000,28.745152,
60,cylinder craft flying over Galveston with no wings being chased by military jet.,galveston,2009-08-05,-94.7975,tx,60,1 minute,58852,cylinder,2009-07-02 00:00:00.000000,29.3011111,us
900,A series of  red light flew overhead,santa fe,2011-10-10,-95.1055556,tx,900,15 minutes,58897,light,2011-07-02 22:00:00.000000,29.3777778,us
120,I spotted multiple amber colored orbs appearing &amp; disappearing in the sky just above the horizon. There were several of these orbs that,austin,2013-07-03,-97.7427778,tx,120,couple minutes,58934,circle,2013-07-02 22:00:00.000000,30.2669444,us
7200,A 5 HR DRIVE TOOK 7 PLUS HOURS ROUTINE DRIVE. LOST 2HRS NO EXPLANATION,brenham,2012-11-04,-96.3975,tx,7200,2 hours,58958,,1978-07-22 20:00:00.000000,30.1666667,us
5,Bright Firey ball hovering in sky.,lavon,2000-07-23,-96.4338889,tx,5,5 seconds,58987,fireball,2000-07-22 21:50:00.000000,33.0275000,us
300,it look lie a box gold wavie very hot and loud like jet plan,three rivers,2006-10-30,-98.1822222,tx,300,5 min.,59042,other,2006-07-22 00:00:00.000000,28.4600000,us
45,Witnessed a group of 8 or 10 high altitude glowing lights traveling at very high speed from north to south over austin,austin,2007-08-07,-97.7427778,tx,45,45 seconds,59043,circle,2007-07-22 00:15:00.000000,30.2669444,us
300,about 3 white lights&#44 close together&#44 flying in mid sky in straight line at somewhat a fast speed,buda,2009-08-05,-97.84,tx,300,5 mins,59075,light,2009-07-22 23:06:00.000000,30.0850000,us
120,Two triangle objects with blinking white and one red light. Flying at very low altitudes over suburbs silently.,allen,2011-08-07,-96.6702778,tx,120,2min,59098,triangle,2011-07-22 03:00:00.000000,33.1030556,us
4,White light fell out of the sky,mckinney,2011-08-07,-96.615,tx,4,4 seconds,59099,light,2011-07-22 20:30:00.000000,33.1975000,us
2,It was bright circle that flew very fast and below airplane level,houston,2011-08-07,-95.3630556,tx,2,2 seconds,59100,light,2011-07-22 20:55:00.000000,29.7630556,us
10,Green light in the sky&#44 Houston&#44 TX,houston,2011-08-07,-95.3630556,tx,10,10 seconds,59101,light,2011-07-22 21:00:00.000000,29.7630556,us
300,I am a truck driver I was traveling west bound on I 10 through the town of van Horn a appox 11:00PM Friday the 23rd.  I was listening t,van horn,1999-08-10,-104.8302778,tx,300,5 min,59168,disk,1999-07-23 23:00:00.000000,31.0397222,us
2,white object between Ft Worth and Dallas,fort worth,2004-07-25,-97.3205556,tx,2,seconds,59232,unknown,2004-07-23 15:30:00.000000,32.7252778,us
1260,Two craft near Houston witnessed by 8 people....AMAZING&#33&#33&#33  Pictures taken...,houston,2005-05-24,-95.3630556,tx,1260,21 minutes,59237,formation,2004-07-23 21:12:00.000000,29.7630556,us
900,white&#44 small balls floating at a high altitude&#44 very faint&#44 barely visible.,houston-college station,2005-12-16,-96.340221,tx,900,less than 15mins,59249,teardrop,2005-07-23 16:00:00.000000,30.612393,
600,It was like watching the changing of the guards&#44 but they looked like moving stars?,whitewright,2005-09-02,-96.3922222,tx,600,10 minutes,59253,light,2005-07-23 21:45:00.000000,33.5127778,us
900,gold box maybe 30 x30 feet very hot wavie loud like a jet plane i was 100 yards from it,burton,2006-10-30,-96.5952778,tx,900,15min.,59257,other,2006-07-23 03:00:00.000000,30.1819444,us
2,7/23/07  - Big Bend Nat&#39l Park 20 miles from Terlingua&#44 Tx   - diamond shaped yellow craft in photograph,big bend natinal park,2007-10-08,-103.242538,tx,2,seconds,59265,diamond,2007-07-23 10:00:00.000000,29.127487,
3,Fireball near DFW Airport on 7/23/07,flower mound,2007-08-07,-97.0966667,tx,3,3 seconds,59268,fireball,2007-07-23 22:50:00.000000,33.0144444,us
1200,Orange Orb/Ball near Downtown Houston.,houston,2012-08-19,-95.3630556,tx,1200,20 minutes,59316,fireball,2011-07-23 19:20:00.000000,29.7630556,us
120,Sighting in Del Rio&#44 Texas,del rio,2008-07-05,-100.8963889,tx,120,2 minutes,59372,diamond,1985-07-24 21:00:00.000000,29.3625000,us
20,I feel a little silly about this but I was standing on my back patio when what i thought was a plane flew from SW to NE no sound and ch,garland,1999-08-10,-96.6386111,tx,20,15 to 20 seconds,59386,changing,1999-07-24 00:25:00.000000,32.9125000,us
30,30 sec speeding lights over Franklin Mountain range.,el paso,2005-09-02,-106.4863889,tx,30,30 sec.,59440,formation,2005-07-24 23:17:00.000000,31.7586111,us
180,Shiny object near chem-trail in the sky.,corpus christi,2008-10-31,-97.3961111,tx,180,2-3 minutes,59461,other,2008-07-24 18:00:00.000000,27.8002778,us
180,strange lights in the NW sky observed and two flashes like a camera flash,lindsay,2009-08-05,-97.2225,tx,180,3 min,59482,unknown,2009-07-24 20:00:00.000000,33.6358333,us
120,3 lighted silent craft flys slowly over university,san marcos,2009-08-05,-97.9411111,tx,120,1.5 - 2 minutes,59491,triangle,2009-07-24 22:00:00.000000,29.8830556,us
300,Multi-colored pulsing light in sky.  ((NUFORC Note:  Venus is in the northwest sky&#44 at the time indicated.  PD)),kingwood,2010-07-28,-95.190299,tx,300,5 minutes,59504,changing,2010-07-24 00:50:00.000000,30.057536,
10800,Green light that darted and manuevered in amazing ways and large amounts of falling stars&#44 etc.,sloan,2011-08-07,-97.669393,tx,10800,3 hours +,59518,light,2011-07-24 00:00:00.000000,30.496803,
10,Orange sphere over TX,san antonio,2011-08-07,-98.4933333,tx,10,10 secs,59522,circle,2011-07-24 18:00:00.000000,29.4238889,us
35,High speed low altitude pass from east to west at approx. 500 ft high.after passing to the left made 45 degree right turn and vanished.,verhalen (between balmorea &amp; pecos,1999-10-02,-103.493229,tx,35,35 seconds,59614,diamond,1999-07-25 22:30:00.000000,31.422912,
7200,Bright light (Venus-like)&#44 green&#44 red and white&#44 stationary for 2+ hours.,beaumont (outside),2002-07-30,-94.1016667,tx,7200,2 hours,59642,light,2002-07-25 02:00:00.000000,30.0858333,us
60,Large white and gray rectangular object hovering in sky.,houston,2004-07-25,-95.3630556,tx,60,about a minute,59671,rectangle,2004-07-25 18:30:00.000000,29.7630556,us
300,Lake KIowa  Texas UFO,lake kiowa,2008-08-12,-97.0127778,tx,300,5 minutes,59714,triangle,2008-07-25 05:10:00.000000,33.5769444,us
2,circling hawks precede spaceship sightings,pampa,2009-08-05,-100.9594444,tx,2,seconds,59743,other,2009-07-25 16:30:00.000000,35.5361111,us
60,Yellow ball of light following a commercial airliner.,el paso,2010-08-24,-106.4863889,tx,60,1 minute,59784,light,2010-07-25 21:20:00.000000,31.7586111,us
1,Light shoots across sky with another cradt that seemed to watch it.,watauga,2013-08-30,-97.2544444,tx,1,1 second,59824,light,2013-07-25 02:00:00.000000,32.8577778,us
60,When my roommate and I were sitting outside late last night when we witnesses two large white burst of light that lite up the entire sk,smithville (south east of),2000-08-19,-97.1591667,tx,60,less than 1 minute,59874,,2000-07-26 23:10:00.000000,30.0083333,us
5,flashing ball of light in the sky,fulshear,2000-08-19,-95.8994444,tx,5,5 seconds,59875,fireball,2000-07-26 23:15:00.000000,29.6897222,us
2,I saw a red light through the tree&#44 a blue light scanned me up and down and went out.,brenham,2000-08-05,-96.3975,tx,2,few seconds,59876,light,2000-07-26 23:20:00.000000,30.1666667,us
25,I WAS SITTING ON MY CARPORT WHEN I LIGHT CAME SHINING THROUGH THE TREE,iola,2000-07-29,-96.0747222,tx,25,25 seconds,59877,unknown,2000-07-26 23:30:00.000000,30.7716667,us
120,THESE LOOKED LIKE A TRUE CHAMZ SIGHTING. ORANGE RED AND YELLOW FIREBALLS FLEW RIGHT PAST US ABOUT 100 FEET UP IN THE SKY. THEY MOVED RE,dallas,2002-07-30,-96.8,tx,120,2min,59898,fireball,2002-07-26 22:45:00.000000,32.7833333,us
30,The silent object appeared to be glowing and then began to grow dimmer before I lost it&#44 and I got six pictures of the event.,avinger (lake o&#39 the pinext),2005-09-02,-94.5561111,tx,30,30 seconds,59933,changing,2005-07-26 19:58:00.000000,32.8997222,us
60,Bright light near Dallas.,mckinney,2006-10-30,-96.615,tx,60,1 minute,59943,unknown,2006-07-26 22:30:00.000000,33.1975000,us
1800,&quot;Star&quot; moving extremily fast across the sky&#44 not a sattelite or plane.,san antonio,2007-08-07,-98.4933333,tx,1800,30 min,59949,unknown,2007-07-26 22:00:00.000000,29.4238889,us
15,Small&#44 bright&#44 yellow/orange lights in a pattern and on same plane,cotulla,2011-08-07,-99.2347222,tx,15,15 seconds,59996,rectangle,2011-07-26 19:30:00.000000,28.4366667,us
900,We saw a cigar-shaped&#44 craft with pulsating green&#44 red&#44 and yellow lights that defied normal earthly aircraft movements.,san antonio,2004-01-22,-98.4933333,tx,900,15 min,60050,cigar,1983-07-27 21:00:00.000000,29.4238889,us
30,Extraordinary Event&#33 Neighborhood witnesses oval light with large luminous contrail pass over houses 400 yds away at 150 ft&#33,the colony/lewisville lake (north of dallas),1999-08-10,-96.971398,tx,30,30 seconds,60073,oval,1999-07-27 22:00:00.000000,33.109472,
3,A distant ball of blue and orange light that disappeared after rapidly moving at a downward angle.,el paso,2003-08-01,-106.4863889,tx,3,3 seconds,60107,light,2003-07-27 00:10:00.000000,31.7586111,us
600,Aurora/U.F.O. sighting in San Antonio,san antonio,2007-08-07,-98.4933333,tx,600,10 minutes,60156,triangle,2007-07-27 12:00:00.000000,29.4238889,us
420,Wavey  Wings with Strobe Lights &#33&#33&#33&#33 Lasted for 7 Mins,leander,2008-08-12,-97.8527778,tx,420,7 min,60177,oval,2008-07-27 03:30:00.000000,30.5786111,us
180,Daytime sighting on busy freeway&#44 UFO landed.,san antonio,2008-08-12,-98.4933333,tx,180,3 minutes or so,60179,oval,2008-07-27 13:10:00.000000,29.4238889,us
35,Unknown lights hovering above store.,flower mound,2011-01-31,-97.0966667,tx,35,35 seconds,60187,light,2009-07-27 03:30:00.000000,33.0144444,us
3,Fast flash not typical of meteor,payne springs,2011-08-07,-96.0666667,tx,3,0.03,60216,flash,2011-07-27 00:20:00.000000,32.2780556,us
3,Two objects seen flying east then dissapeared,el paso,2011-08-07,-106.4863889,tx,3,3 seconds,60225,sphere,2011-07-27 05:18:00.000000,31.7586111,us
2700,Triangle and oblong shaped saucers,san antonio,2013-08-30,-98.4933333,tx,2700,45 minutes,60262,changing,2013-07-27 02:00:00.000000,29.4238889,us
120,a object entering the area at a 45 degree angle&#44 turning the sky a bright green.  The object slowed down and finally went level and lig,arlington,1999-10-02,-97.1077778,tx,120,2 minutes,60304,cigar,1985-07-28 03:15:00.000000,32.7355556,us
5,I observed a golden sphere in the southwestern sky at about 5:30 am moving slowly north.,tyler,2000-08-19,-95.3008333,tx,5,5 seconds,60332,sphere,2000-07-28 05:30:00.000000,32.3511111,us
6,sighting of 15 to 20 white trangles in early morning hours of 7-28 01over texas,wichita falls,2001-08-05,-98.4930556,tx,6,apprx. 5to 6 seconds,60338,triangle,2001-07-28 03:20:00.000000,33.9136111,us
600,Dark immobile object in the afternoon sky,dallas,2001-08-05,-96.8,tx,600,10 minutes,60342,unknown,2001-07-28 11:30:00.000000,32.7833333,us
10,Glowing Green Ball travelling slowly about 50-200 feet from earth in Houston at Westheimer/Chimney Rock,houston,2003-08-01,-95.3630556,tx,10,10 seconds,60371,circle,2003-07-28 20:50:00.000000,29.7630556,us
5,Orange fireball w/green glow &amp; trail low in sky no noise,houston,2003-08-01,-95.3630556,tx,5,5 seconds,60372,fireball,2003-07-28 21:00:00.000000,29.7630556,us
6,HBCCUFO CANADIAN REPORT:  Flash was a large bright red flame shaped object,tomball,2003-08-01,-95.6158333,tx,6,approx: 5 to 6 sec.,60373,flash,2003-07-28 21:00:00.000000,30.0969444,us
5,The trajectory was upwards and the flash was a large bright red flame shaped object with a blueish halo and it had a tail and dissap,tomball,2003-08-01,-95.6158333,tx,5,5 seconds,60374,other,2003-07-28 21:00:00.000000,30.0969444,us
5,We saw this fireball as well&#44 over 150 miles outside of Houston,nacogdoches,2003-08-04,-94.6552778,tx,5,5 seconds,60375,fireball,2003-07-28 22:00:00.000000,31.6033333,us
