duration_seconds_int,comments,city,date_posted,longitude,state,duration_seconds,duration_hours,id,shape,datetime,latitude,country
1800,my brother and i wached 4 cigar shaped figures for about 20 min. ((NUFORC Note:  Student report.  PD)),san antonio,2006-07-16,-98.4933333,tx,1800,30 min,38847,cigar,2006-04-24 12:00:00.000000,29.4238889,us
120,I saw four orange lights in a triangular formation gliding above me about 300 ft. they did not make any noise and glided over the neigh,austin,2010-05-12,-97.7427778,tx,120,2 minutes,38893,light,2010-04-24 10:15:00.000000,30.2669444,us
600,Orange lights seen over the Houston area traveling east to west in pairs.,houston,2010-05-12,-95.3630556,tx,600,10 minutes,38898,light,2010-04-24 23:07:00.000000,29.7630556,us
3600,7-10 Orange/Red Lights seen&#44 blackberry battery drained,houston,2010-05-12,-95.3630556,tx,3600,1 hour,38899,circle,2010-04-24 23:15:00.000000,29.7630556,us
10,cluster of small dots tinted yellow&#44 glowing&#44 looked like it disappeared under blanket at night.,round rock,2011-05-02,-97.6786111,tx,10,10 sec.,38903,teardrop,2011-04-24 00:04:00.000000,30.5080556,us
300,Four lights hovering over powerlines leaving graphite type substance on ground,athens,2011-06-20,-95.8552778,tx,300,3 - 5 minutes,38914,circle,2011-04-24 23:45:00.000000,32.2047222,us
10,Saw boomerang shaped&#44 low-flying craft gliding at high rate of speed; shooting star immediately followed,highland village,2012-05-13,-97.0463889,tx,10,10 seconds,38924,other,2012-04-24 22:30:00.000000,33.0916667,us
120,Orange/red pulsing light&#44 first noticed it coming into view over the east/north eastern horizon. Moving accross the sky at high altitud,north zulch,2014-05-02,-96.1080556,tx,120,2 minutes,38958,light,2014-04-24 21:30:00.000000,30.9175000,us
240,I saw what looked to be like a mist coming across the sky to the west of where I was at. As I watched it I saw A formation of what look,carrollton,2000-05-03,-96.89,tx,240,4 mins,39004,formation,2000-04-25 23:15:00.000000,32.9536111,us
1,Green streak of light covered about 1/3 of the sky in one second&#44 changed to white as it neared the horizon and faded out.,houston,2001-04-28,-95.3630556,tx,1,one second,39011,light,2001-04-25 20:30:00.000000,29.7630556,us
1980,Durning a lightning storm a grey jellyfish looking craft that emitts no light changes in to a 3-D rectangle with lights.,austin,2008-06-12,-97.7427778,tx,1980,33 minutes,39066,teardrop,2008-04-25 11:14:00.000000,30.2669444,us
300,I was looking west at the night sky looking for meteorites.  I saw what i thought was a great one come in very fast almost straight ove,kaufman,2010-05-12,-96.3086111,tx,300,5 min,39087,fireball,2010-04-25 17:50:00.000000,32.5888889,us
360,My report of Sunday night April 24 9:50 pm 17:50 hrs  I was out in the open Night sky lying on my hammock with my face toward the north,kaufman,2010-05-12,-96.3086111,tx,360,6 min,39089,fireball,2010-04-25 21:50:00.000000,32.5888889,us
12,Rectangular object soaring silently with no lights or sound and with a digital camouflage pattern,rockwall,2011-05-02,-96.4594444,tx,12,8-12 seconds,39094,rectangle,2011-04-25 21:52:00.000000,32.9311111,us
180,An event I thought was awesome&#33,dallas,2011-05-12,-96.8,tx,180,3 minutes,39095,triangle,2011-04-25 22:00:00.000000,32.7833333,us
120,Not a plane,spring,2012-05-13,-95.4169444,tx,120,2:00,39099,sphere,2012-04-25 07:30:00.000000,30.0797222,us
120,3 lights in trianglular formation over nw dallas,dallas,2002-07-26,-96.8,tx,120,1 to 2 minutes,39144,light,1988-04-26 23:00:00.000000,32.7833333,us
300,At school my friend and I saw ufo hovering back and forth behind a radio anntena&#44 to slow for plane too fast turning for chopper. It wa,mcallen,1999-01-28,-98.2297222,tx,300,5 min.,39146,disk,1996-04-26 12:30:00.000000,26.2030556,us
5,Leap-frogging lights - 3 in front group and one trailing behind.,arlington,2003-05-02,-97.1077778,tx,5,5 seconds,39176,light,2003-04-26 23:00:00.000000,32.7355556,us
3600,Slow moving&#44 low flying 3 light object&#44 not a helicopter&#44 with a dual humming sound.,mineola,2006-05-15,-95.4880556,tx,3600,1 hour,39202,other,2006-04-26 22:00:00.000000,32.6630556,us
300,Daylight reporting of a large saucer shaped UFO in West Texas,fort davis,2008-06-12,-103.8941667,tx,300,5 minutes,39207,disk,2007-04-26 18:30:00.000000,30.5880556,us
5,Bright ball going east to west.,caddo mills,2009-01-10,-96.2275,tx,5,5 seconds,39214,disk,2008-04-26 20:00:00.000000,33.0655556,us
30,Green light moves across Texas sky and then disappears.,hallsville,2008-06-12,-94.5738889,tx,30,30 sec,39218,changing,2008-04-26 20:45:00.000000,32.5041667,us
3,Fast moving object.  Three white lights on side or bottom.,groveton,2008-06-12,-95.1255556,tx,3,3 seconds,39220,unknown,2008-04-26 21:00:00.000000,31.0547222,us
900,Advanced flying machines in harris county.,houston,2008-06-12,-95.3630556,tx,900,15 minuts,39227,other,2008-04-26 00:00:00.000000,29.7630556,us
180,4/26/12 10:29PM OBLONG/OVAL&#44 BIG TRANSLUCENT&#44 UNKNOWN SILENT OBJECT FLYING ABOUT 400 FEET IN THE SKY.,harlingen,2012-05-13,-97.6958333,tx,180,2-3 minutes,39263,oval,2012-04-26 22:00:00.000000,26.1902778,us
20,The object almost impacted our windshield,austin,2013-05-15,-97.7427778,tx,20,20 seconds,39282,rectangle,2013-04-26 23:00:00.000000,30.2669444,us
8,Two UFOs photographed in full daylight&#44 one punched a cookie-cutter shape in a cloud.,san antonio,2014-05-02,-98.4933333,tx,8,8 seconds,39290,sphere,2014-04-26 16:57:00.000000,29.4238889,us
10800,Triangle yellowish/peach light zig zag 3hrs over northeast Texas sky at night.,maud,2014-05-02,-94.3425,tx,10800,3 hours,39292,triangle,2014-04-26 17:00:00.000000,33.3327778,us
5,The light was moving very quickly in erratic behavior over veterans park in dalWorthington Texas.,pantego,2014-05-02,-97.1561111,tx,5,5 seconds,39299,circle,2014-04-26 21:15:00.000000,32.7141667,us
10,April 27 sighting in Dallas TX.   Possibly the same object previously reported from Plano TX.,dallas,2000-06-21,-96.8,tx,10,10 seconds,39323,light,2000-04-27 20:40:00.000000,32.7833333,us
3,I saw a craft moving at an incredible speed&#44 from north to south. The object was lit on it&#39s underside&#44 but only in a pattern of a rod.,plano,2000-05-03,-96.6986111,tx,3,3 seconds,39327,triangle,2000-04-27 23:38:00.000000,33.0197222,us
20,Strange shape observed gliding over Galveston island during a warm Saturday afternoon.,galveston,2002-05-14,-94.7975,tx,20,20 seconds,39338,other,2002-04-27 15:30:00.000000,29.3011111,us
2,green fireball,austin,2003-04-27,-97.7427778,tx,2,seconds,39343,fireball,2003-04-27 04:30:00.000000,30.2669444,us
360,Brilliant magnesium diamond seen over Dyess Air Force Base/ Abilene &#44Texas,abilene,2007-06-12,-99.7327778,tx,360,6 minutes,39375,unknown,2007-04-27 00:00:00.000000,32.4486111,us
300,UFO sighting in San Antonio&#44 Texas,san antonio,2008-06-12,-98.4933333,tx,300,5 minutes,39382,changing,2008-04-27 11:15:00.000000,29.4238889,us
600,4/27/2013  12:00 am  bandera   tx 10 mins.  light  changing white&#44yellow&#44red   bouncing motion then sped off.  5/17/13,bandera,2013-06-02,-99.0733333,tx,600,10 minutes,39420,light,2013-04-27 01:00:00.000000,29.7263889,us
420,A large disc hovering about ~30 ft from the ground,snyder,2013-05-15,-100.9172222,tx,420,5-7 minutes,39423,disk,2013-04-27 02:30:00.000000,32.7177778,us
30,My wife and I witnessed around 10 to 13 amber  lights flying in a &#39V&#39 formation at a high rate of speed over Houston.,houston,1999-01-28,-95.3630556,tx,30,30 seconds,39488,light,1997-04-28 22:00:00.000000,29.7630556,us
5,4 UFOs flying in formation,round rock,2004-04-30,-97.6786111,tx,5,5 sec.,39531,oval,2004-04-28 00:22:00.000000,30.5080556,us
30,I am a police officer and was working my night shift at our headquarters building checking doors and locks.  When I stepped outside I l,austin,2007-11-28,-97.7427778,tx,30,30 seconds,39561,triangle,2007-04-28 03:45:00.000000,30.2669444,us
1800,Object &amp; airplane almost collide,brownsville,2008-06-12,-97.4972222,tx,1800,30 minutes,39569,light,2008-04-28 20:45:00.000000,25.9013889,us
6,Southlake&#44 Tx: Crescent shaped&#44 white light clearly observed gliding through the sky.,southlake,2011-05-12,-97.1338889,tx,6,6 seconds,39593,other,2011-04-28 11:15:00.000000,32.9411111,us
120,angular shaped object,comfort,2005-05-11,-98.9047222,tx,120,1-2 minutes,39712,triangle,2005-04-29 23:00:00.000000,29.9675000,us
6,A triangle shaped craft with brilliant lights flew over my house.,buda,2008-06-12,-97.84,tx,6,6 seconds,39758,triangle,2008-04-29 23:00:00.000000,30.0850000,us
60,Organic E.T. Craft,kingwood,2013-07-14,-95.190299,tx,60,30-60 seconds,39794,other,2012-04-29 21:22:00.000000,30.057536,
180,Fireball over San Antonio.,san antonio,2013-05-15,-98.4933333,tx,180,3 minutes,39806,fireball,2013-04-29 19:15:00.000000,29.4238889,us
60,i did not  look scary or spooky just  something i had never seen before or since,sinton,2001-03-06,-97.5088889,tx,60,60 seconds,39829,oval,1977-04-30 23:00:00.000000,28.0363889,us
10,Fireball&#44 green with white center&#44 with a tail of white sparkling stuff. It went horozontally across sky&#44 winked out.,austin,1999-02-16,-97.7427778,tx,10,10 seconds,39843,sphere,1998-04-30 19:00:00.000000,30.2669444,us
240,I saw 3 U.F.O.s they scared the heck out of me&#44 loud noises and bright lights.,port aransas,2003-05-02,-97.0608333,tx,240,3-4 minutes,39866,other,2003-04-30 23:37:00.000000,27.8336111,us
1,Blue Flash of Light which covered the SE sky (not man-made).,houston,2004-05-04,-95.3630556,tx,1,1 sec,39884,flash,2004-04-30 23:15:00.000000,29.7630556,us
7,DIM AMBER  LIGHTS IN TRIANGULAR SHAPE OVER ORANGE TEXAS,orange,2006-05-15,-93.7363889,tx,7,7 seconds,39899,triangle,2006-04-30 22:15:00.000000,30.0927778,us
10,No lights flying very low&#44 silent flew right over my head&#44 blocked out view of stars as it passed.,euless,2006-05-15,-97.0816667,tx,10,10 seconds,39900,triangle,2006-04-30 22:25:00.000000,32.8369444,us
30,El Paso bright orange light,el paso,2008-06-12,-106.4863889,tx,30,30 seconds,39921,light,2008-04-30 23:45:00.000000,31.7586111,us
300,((HOAX??))  backyard,frisco,2009-05-12,-96.8233333,tx,300,5 minutes,39922,unknown,2009-04-30 09:07:00.000000,33.1505556,us
3,It looked like the one from &quot;race to witch mountain&quot; and it came back a couple of times.,houston,2009-12-12,-95.3630556,tx,3,2-3 seconds,39930,circle,2009-04-30 23:00:00.000000,29.7630556,us
60,Three dark low flying objects&#44 no lights&#44 no sound&#44 illuminated by the city lights of Bastrop&#44 Tx.,bastrop,2013-05-15,-97.315,tx,60,<1 minute,39967,formation,2013-04-30 22:00:00.000000,30.1102778,us
120,Craft moving at a high rate of speed was quickly changing directions and then vanished.,converse,1999-04-26,-98.3158333,tx,120,2 minutes,40008,light,1999-04-03 23:16:00.000000,29.5177778,us
3,Green fireball fell from sky  near Richwood&#44 Texas in the vicinity northeast of FM2004 and north of Hwy 288,lake jackson/brazoria/richwd,2003-04-22,-95.419431,tx,3,3 seconds,40020,circle,2003-04-03 22:30:00.000000,29.019671,
30,Daytime Light near Bowie&#44 Tx,bowie,2006-05-15,-97.8483333,tx,30,30 sec,40043,changing,2006-04-03 13:55:00.000000,33.5588889,us
20,UFO&#39S Seen in Wichita Falls&#44 Texas/Sheppard AFB area April 3&#44 2008,wichita falls,2008-06-12,-98.4930556,tx,20,20 seconds,40060,changing,2008-04-03 16:22:00.000000,33.9136111,us
60,Airplanes with silent engines?,winters,2008-04-17,-99.9619444,tx,60,< 1 minute,40065,other,2008-04-03 23:00:00.000000,31.9563889,us
5,That was no falling  star&#33&#33,lubbock,2010-11-21,-101.8547222,tx,5,5 seconds,40077,triangle,2010-04-03 01:00:00.000000,33.5777778,us
6,Observed on a clear&#44 cloudless night sky (10:45 PM) a wedge-shape object with 9-10 running lights spaced evenly over entire craft.,georgetown,2010-04-13,-97.6769444,tx,6,5-6 seconds,40086,triangle,2010-04-03 00:00:00.000000,30.6325000,us
5,Fast moving light that stopped&#44 moved backwards and took off again.,dallas,2004-01-17,-96.8,tx,5,5 seconds,40134,light,1979-04-04 06:00:00.000000,32.7833333,us
20,SOUTH WEST OF LIPAN&#44 TX&#44 ONE ORANGE BALL OF LIGHT SPLITS TO 3&#44 THEN VANISH.,lipan (sw of),2011-05-02,-98.0455556,tx,20,20 seconds,40258,other,2011-04-04 20:32:00.000000,32.5183333,us
2,Lights in sky over fowlerton&#44tx,fowlerton,2013-05-15,-98.8105556,tx,2,2 seconds,40274,unknown,2013-04-04 22:30:00.000000,28.4652778,us
2700,Texas 1967&#44 Triangle of lights turning around common center&#44 with many smaller companion lights.,middle of desert,2004-04-27,-106.305807,tx,2700,45 minutes,40291,light,1967-04-05 22:00:00.000000,31.754336,
30,Perfect disk with lights on edge; one side red&#44 one side green: no sound No clouds&#44 disk blocked out stars&#44 moving S.to N.,houston,1998-06-18,-95.3630556,tx,30,30 seconds,40293,disk,1973-04-05 21:30:00.000000,29.7630556,us
300,I have a childhood memory of looking out front window&#44 and seeing a glowing&#44 pink house floating in the sky.  When I read the book Comm,arlington,1998-11-01,-97.1077778,tx,300,4-5 minutes,40296,triangle,1984-04-05 21:30:00.000000,32.7355556,us
600,One Hovering craft...Multi-colored lights...Possible USAF persuit&#33,mineola,1999-07-05,-95.4880556,tx,600,10min,40319,circle,1999-04-05 21:10:00.000000,32.6630556,us
150,burning object came down changing trajectory as it crashed unknown type/origin.,bedford,2003-04-22,-97.1427778,tx,150,2.5 minutes,40337,unknown,2003-04-05 10:30:00.000000,32.8438889,us
180,I Saw this today&#33 i was on a flight from  LA to Nashville tn. around 3:15 central Time NEVER SEEN ANYTHING LIKE IT BEFORE&#33&#33,in-flight (texas),2003-04-22,-96.834854,tx,180,3 min,40341,cigar,2003-04-05 15:15:00.000000,32.972579,
120,Flying triangle in sky over San Marcos,san marcos,2006-05-15,-97.9411111,tx,120,2 min,40380,triangle,2006-04-05 22:25:00.000000,29.8830556,us
25,PLane looking object  disenegrates over Texas sky.,san antonio,2007-04-27,-98.4933333,tx,25,25 seconds,40382,other,2007-04-05 14:56:00.000000,29.4238889,us
20,On a clear blue afternoon sky&#44 there appeared a slow moving disk-like shiny object that gradually vanished after about 20 seconds,cedar park,2009-04-14,-97.82,tx,20,20 seconds,40396,disk,2009-04-05 16:20:00.000000,30.5050000,us
120,Oval shaped objects,mccamey (near),2006-05-15,-102.2238889,tx,120,approx 2 minutes,40409,oval,2006-04-06 05:50:00.000000,31.1358333,us
120,Fireball.,ft. worth,2013-05-15,-97.3205556,tx,120,2 minutes,40444,fireball,2013-04-05 23:36:00.000000,32.7252778,us
240,Formation of Red Lights Over Zilker Park.,austin,2014-04-11,-97.7427778,tx,240,4 minutes,40474,light,2014-04-05 22:15:00.000000,30.2669444,us
669,UFO&#39S over Mesquite&#44 TX.,mesquite,2014-04-11,-96.5988889,tx,669,11:09,40477,cylinder,2014-04-05 22:20:00.000000,32.7666667,us
900,Six red lights forming a triangle was seen then disappeared in to the clouds.,san antonio,2014-04-11,-98.4933333,tx,900,15 minutes,40478,triangle,2014-04-05 22:30:00.000000,29.4238889,us
900,UFO sighting.,san antonio,2014-04-11,-98.4933333,tx,900,15 minutes,40479,triangle,2014-04-05 22:30:00.000000,29.4238889,us
4,Green comet looking thing flew across sky.,austin,1999-04-26,-97.7427778,tx,4,4 secs.,40493,fireball,1999-04-06 10:38:00.000000,30.2669444,us
4,Driving on Highway 175 West towards I-635 north beltway of Dallas; less than one-half of a mile to I-635 north exit I saw a flying obje,seagoville (city of&#44 and dallas city),2000-04-15,-96.5380556,tx,4,4 seconds,40498,circle,2000-04-06 15:28:00.000000,32.6394444,us
12,Two&#44 bright Green Lights&#44 orbs or UFO&#39s&#44 traveling at a High rate of speed with one orange companion object dancing around the lead obj,arlington,2000-04-15,-97.1077778,tx,12,12 sec.,40504,light,2000-04-06 20:35:00.000000,32.7355556,us
10,appeared first as dim satellite&#44 gradually becoming very bright&#44 and finally dimming until no longer seen,san antonio,2000-04-26,-98.4933333,tx,10,5-10 seconds,40505,light,2000-04-06 21:08:00.000000,29.4238889,us
120,Several white lights outside my daughters home.,san antonio,2011-05-02,-98.4933333,tx,120,few minutes,40575,other,2011-04-06 15:21:00.000000,29.4238889,us
1800,Object is twice as bright as Venus in my Western sky&#44 4 of the last 10 or 12 nights for 30 minutes hovering&#44 slowly moves W. from site.,wichita falls,2012-04-18,-98.4930556,tx,1800,30 minutes,40595,light,2012-04-06 23:00:00.000000,33.9136111,us
300,Red light and circular shape.,houston,2013-04-12,-95.3630556,tx,300,5 minutes,40596,circle,2013-04-06 08:45:00.000000,29.7630556,us
45,Three balls of light flying overhead in a zig zag motion.,austin,2013-05-15,-97.7427778,tx,45,45 seconds,40606,fireball,2013-04-06 20:55:00.000000,30.2669444,us
30,I witnessed a two large yellow orange spheres pop out of the North East corner of the sun.  ((NUFORC Note:  Lens flares?  PD)),paris,2014-04-18,-95.5552778,tx,30,30 seconds,40625,sphere,2014-04-06 11:30:00.000000,33.6608333,us
1800,I was driving northbound on I-35&#44 and was around 5 miles south of Austin when I noticed an intensely bright white light far ahead on th,austin,2009-01-10,-97.7427778,tx,1800,30 mins,40651,triangle,1997-04-07 17:00:00.000000,30.2669444,us
5,It seemed remarkable as it didn&#39t look like any shooting star or object we had ever seen.,austin,2004-04-27,-97.7427778,tx,5,5 seconds,40679,light,2004-04-07 20:15:00.000000,30.2669444,us
3,LARGE VERY BRIGHT SPHERE &#44AS BRIGHT AS A FLASH BULB.,port mansfield,2004-04-27,-97.4247222,tx,3,3 seconds,40680,cone,2004-04-07 21:00:00.000000,26.5544444,us
10,6 dots moved across the sky and faded out.,college station,2004-04-09,-96.3341667,tx,10,10 sec,40687,formation,2004-04-07 23:00:00.000000,30.6277778,us
120,MOST UNUSAL OBJECT ]--[ SEEN IN HEBBRONVLLE&#44 TEXAS MANY OTHERS SAW IT.,hebronville,2006-05-15,-98.678352,tx,120,1-2minutes,40711,other,2006-04-07 20:30:00.000000,27.306706,
2,Ball of light then faded out.  ((NUFORC Note:  Iridium satellite??  PD)),tuscola,2008-06-12,-99.7963889,tx,2,few seconds,40734,light,2008-04-07 22:00:00.000000,32.2094444,us
1200,Bright Star like object,austin,2009-04-14,-97.7427778,tx,1200,about 20 min,40740,circle,2009-04-07 00:00:00.000000,30.2669444,us
20,A very bright object over Austin TX that follows plan then passes it like nothing seem to be investigating the plan.,austin,2009-04-14,-97.7427778,tx,20,15 -20 seconds,40742,unknown,2009-04-07 18:50:00.000000,30.2669444,us
1800,Pictures were taken on cell phone.,abilene,2009-04-14,-99.7327778,tx,1800,30 minutes,40747,triangle,2009-04-07 22:30:00.000000,32.4486111,us
12600,Hovering&#44 silver disk viewed from Park Mountain towards downtown San Antonio&#44 TX.,san antonio,2011-05-02,-98.4933333,tx,12600,3.5 hours,40760,circle,2011-04-07 02:00:00.000000,29.4238889,us
2700,Lights over cedar park,cedar park,2012-04-18,-97.82,tx,2700,45 minutes,40777,changing,2012-04-07 21:00:00.000000,30.5050000,us
30,5 red lights in the shape of a triangle,dallas,2012-04-18,-96.8,tx,30,30 seconds,40785,triangle,2012-04-07 22:30:00.000000,32.7833333,us
10,UFO over Houston park,houston,2004-04-27,-95.3630556,tx,10,10 seconds,40857,cylinder,2004-04-08 23:17:00.000000,29.7630556,us
900,Waiting for the bus home&#44 i eyewitnessed at lest 10-15 at first maybe an little balloon in the air than i see two more&#44 than other star,dallas,2005-04-16,-96.8,tx,900,15 minutes,40862,unknown,2005-04-08 17:00:00.000000,32.7833333,us
60,It was a circular object completely black except for flashing lights.,atascocita,2010-04-13,-95.1763889,tx,60,1 minute,40898,disk,2010-04-08 00:22:00.000000,29.9986111,us
45,Pulsating light flew over Dripping Springs&#44 Texas at a high rate of speed on Thursday evening 04/08/10 at 20:49 CST.,dripping springs,2010-04-13,-98.0863889,tx,45,45 seconds,40904,oval,2010-04-08 20:49:00.000000,30.1900000,us
45,Pulsating light flew over Dripping Springs&#44 Texas at a high rate of speed on Thursday evening at 20:49 CST.,dripping springs,2010-04-13,-98.0863889,tx,45,45 seconds,40905,oval,2010-04-08 20:49:00.000000,30.1900000,us
60,Bright yellowish/orange in color lights&#44 form triangle shape in the skies over Cotulla Texas&#33,cotulla,2010-04-13,-99.2347222,tx,60,1 min,40907,triangle,2010-04-08 22:00:00.000000,28.4366667,us
4500,Massive mushroom shaped ufo in the sky over Cedar Creek lake on 04/08/2014.,gun barrel city,2014-04-11,-96.1511111,tx,4500,75 minutes,40950,other,2014-04-08 01:15:00.000000,32.3344444,us
10,Austin:  Unexplained silent unlit object moving 100ft over the ground seen at close range,austin,2014-04-11,-97.7427778,tx,10,10 seconds,40957,unknown,2014-04-08 21:15:00.000000,30.2669444,us
180,English words identified on black triangular craft.,sidney,2005-04-16,-98.7369444,tx,180,3 minutes,41026,triangle,2005-04-09 19:09:00.000000,31.9491667,us
180,I just got finish watching a show about UFO&#39s and then I went to the centers website and i say the photo of the Texas UFO and it looks,sidney,2005-06-20,-98.7369444,tx,180,3 mins,41029,triangle,2005-04-09 21:12:00.000000,31.9491667,us
180,TRIANGLE WITH ENGLISH WORDS WRITTEN ON IT IS A PROVEN LIE.,sidney,2005-05-11,-98.7369444,tx,180,3 min,41030,triangle,2005-04-09 21:12:00.000000,31.9491667,us
360,My UFO sighting over the Immigration Rally in Dallas&#44 Tx.,dallas,2006-10-30,-96.8,tx,360,5-6 minutes,41038,changing,2006-04-09 13:30:00.000000,32.7833333,us
30,Triangular lights directly overhead moving silently and slow then saw edge of craft in moon light (circular).,san antonio,2010-04-13,-98.4933333,tx,30,25-30 sec.,41082,triangle,2010-04-09 23:15:00.000000,29.4238889,us
1800,Go to internet mysterius lights in Texas City Texas skys many news reports and actual video,texas city,2012-04-18,-94.9025,tx,1800,30 min,41119,oval,2012-04-09 22:00:00.000000,29.3836111,us
15,A white &quot;star&quot; in the sky began to spiral and zig zag in the sky then zoomed off and  disappeared.,kemah,2005-01-19,-95.0202778,tx,15,10-15 seconds,41161,light,1977-05-10 01:00:00.000000,29.5425000,us
7200,Swirling lights coming out of larger light at high altitude. Fast with trails.  Aware of us observing.,houston  (west),1999-12-16,-95.3630556,tx,7200,2 hrs,41183,light,1995-05-10 19:00:00.000000,29.7630556,us
3,it flashed very bright and then took off at the speed of light with a blue trail following it.,austin,2004-12-03,-97.7427778,tx,3,3 seconds,41186,flash,1997-05-10 00:00:00.000000,30.2669444,us
300,Saw circle of flames that then reduced size to single light&#44travelled quickly across the sky and was followed by military fighter plane,azle,1999-10-19,-97.5455556,tx,300,3-5 min.,41192,circle,1997-05-10 23:00:00.000000,32.8950000,us
2040,it just stayed in one spot and changed color rapidly  then after 30 min it feaded away with no noise or movement,splendora,2001-08-05,-95.1608333,tx,2040,34minutes,41210,unknown,2001-05-10 21:00:00.000000,30.2327778,us
180,I thought it to be Satellites,jacksboro,2001-08-05,-98.1583333,tx,180,3 minutes,41214,triangle,2001-05-10 23:20:00.000000,33.2183333,us
60,fast/manuevering UFO over Spring&#44 Tx. on night of 5/10/02&#44 10pm,spring,2002-05-14,-95.4169444,tx,60,1 minute,41225,circle,2002-05-10 22:00:00.000000,30.0797222,us
15,Object quietly glides of neighborhood-no lights no sound&#33&#33,san antonio,2009-05-12,-98.4933333,tx,15,15 secs,41296,chevron,2009-05-10 21:30:00.000000,29.4238889,us
15,UFO photographed in sky in Corpus Christi&#44 Texas on May 10&#44 2013.,corpus christi,2013-06-02,-97.3961111,tx,15,<15 seconds,41326,disk,2013-05-10 16:50:00.000000,27.8002778,us
900,We saw &quot;rocks&quot; floating in the air&#44 they drifted over the trees.  They appeared to be floating.  Atleast 10 cars were pulled over on th,porter,1999-01-28,-95.2294444,tx,900,15 minutes,41344,other,1997-05-11 12:00:00.000000,30.1022222,us
1800,Low flying shape shifting light sphere spotted by commuters 3 days in a row,houston,2001-08-05,-95.3630556,tx,1800,30min,41357,light,2001-05-11 05:00:00.000000,29.7630556,us
60,White cigar shaped object hangs over Austin Tx then disapears in a flash of white light,austin,2006-05-15,-97.7427778,tx,60,1 minute,41405,cigar,2006-05-11 14:50:00.000000,30.2669444,us
900,very bright object over Elgin Texas,elgin,2006-05-15,-97.37,tx,900,15 minutes,41411,circle,2006-05-11 23:00:00.000000,30.3494444,us
5,Green and White lights spotted near Corsicana&#44 Texas fall from the sky north of 287 East of I-45.,corsicana,2008-06-12,-96.4686111,tx,5,5 seconds,41422,light,2008-05-11 22:30:00.000000,32.0952778,us
120,Orange Light over Fort Worth,watauga/fort worth,2011-05-29,-97.255097,tx,120,2 minutes,41450,light,2011-05-11 20:45:00.000000,32.860536,
600,Saucer flew over house in Houston,houston,2001-04-01,-95.3630556,tx,600,5-10 minutes,41523,disk,1970-05-01 03:00:00.000000,29.7630556,us
5400,Silent &#44bright hovering light&#44 seemed to be teasing us&#44 for miles of desolate highway.,brownfield,2008-10-31,-102.2738889,tx,5400,90 min,41532,light,1973-05-01 14:00:00.000000,33.1811111,us
73800,Bright Burning Light Half Oval Object and 2 1/2 hours of lost time Sighting in Texas City&#44 Texas May 1973  500 Lights On Object0: Yes,texas city,2009-12-12,-94.9025,tx,73800,2 1/2 hours,41534,disk,1973-05-01 20:00:00.000000,29.3836111,us
600,eagle shaped with detailed coloring,eastland,2006-02-14,-98.8172222,tx,600,10 minutes,41539,,1976-05-01 16:00:00.000000,32.4013889,us
1,We saw a lsilent ight in the sky that disappeard as soon as we noticed.,houston,2011-04-03,-95.3630556,tx,1,1 second,41580,unknown,1988-05-01 21:00:00.000000,29.7630556,us
300,This object exucuted manuvers that no man made object could at speeds exceeding any winged craft.,lufkin,2002-11-16,-94.7288889,tx,300,3 to 5 minutes,41627,light,1998-05-01 21:00:00.000000,31.3380556,us
20,I WILL ONLY LEAVE MY EMAIL ADDRESS - THIS IS REAL&#33,houston,1999-05-24,-95.3630556,tx,20,20 seconds,41641,light,1999-05-01 22:00:00.000000,29.7630556,us
